{
  "generated_at": "2026-07-15T12:24:47Z",
  "runtime_id": "example-runtime",
  "model_awareness": {
    "required": true,
    "dynamic_discovery_required": true,
    "status": "degraded",
    "provider_count": 2,
    "unknown_providers": []
  },
  "providers": {
    "implementer-agent": {
      "provider_name": "example-provider-a",
      "model_selection": "runtime_observed",
      "agent_surface": "example-cli-a",
      "model_identity": {
        "agent_surface": "example-cli-a",
        "provider": "example-provider-a",
        "reasoning_mode": "high",
        "permissions": ["task-local-evidence"],
        "context": {"hard_compression_pct": 65},
        "task_evidence": ["evidence/model-observations-start.md"],
        "declared_model": {
          "model_id": "example-model-a-declared",
          "provider": "example-provider-a",
          "reasoning_mode": "xhigh",
          "source": "illustrative capability declaration",
          "timestamp": "2026-07-15T12:24:47Z",
          "confidence": "high",
          "freshness": "current"
        },
        "observed_model": {
          "model_id": "example-model-a-observed",
          "provider": "example-provider-a",
          "reasoning_mode": "high",
          "source": "example adapter observation",
          "timestamp": "2026-07-15T12:24:47Z",
          "confidence": "high",
          "freshness": "current"
        },
        "model_probe": {
          "schema_version": "valp-model-probe.v1",
          "status": "observed",
          "source": "example runtime adapter metadata",
          "observed_at": "2026-07-15T12:24:47Z",
          "ttl_seconds": 3600,
          "model": {
            "model_id": "example-model-a-observed",
            "provider": "example-provider-a",
            "reasoning_mode": "high",
            "confidence": "high"
          },
          "session_identity": {
            "status": "known",
            "token": "sha256:example-session-a",
            "source": "example adapter generation",
            "generation": "7"
          }
        },
        "freshness_evaluated_at": "2026-07-15T12:24:47Z",
        "observation_age_seconds": 0,
        "observation_ttl_seconds": 3600,
        "mismatch": {
          "status": "mismatch",
          "handling": "invalidate",
          "details": "Runtime observation differs from declaration."
        },
        "history_binding": {
          "agent_surface": "example-cli-a",
          "model_id": "example-model-a-observed",
          "provider": "example-provider-a",
          "reasoning_mode": "high",
          "freshness": "current",
          "session_token": "sha256:example-session-a",
          "fingerprint": "f93948a6e2137b8514f0dd31f2e61568b2e0a376930dad1f703ea47cdd7c64e2"
        },
        "history_invalidation_reasons": [
          "declared and observed model identities differ"
        ],
        "history_status": "invalidated",
        "evidence_status": "degraded",
        "role_eligibility": {
          "implementer": "eligible",
          "final_reviewer": "eligible"
        }
      },
      "permissions": ["task-local-evidence"],
      "context": {"hard_compression_pct": 65},
      "task_evidence": ["evidence/model-observations-start.md"]
    },
    "reviewer-agent": {
      "provider_name": "example-provider-b",
      "model_selection": "observed_model",
      "agent_surface": "example-cli-b",
      "model_identity": {
        "agent_surface": "example-cli-b",
        "provider": "example-provider-b",
        "reasoning_mode": "unknown",
        "permissions": ["read-only-review"],
        "context": {"hard_compression_pct": 70},
        "task_evidence": ["evidence/model-observations-start.md"],
        "declared_model": {
          "model_id": "example-model-b",
          "provider": "example-provider-b",
          "reasoning_mode": "unknown",
          "source": "illustrative capability declaration",
          "timestamp": "2026-07-15T12:24:47Z",
          "confidence": "high",
          "freshness": "current"
        },
        "observed_model": {
          "model_id": "example-model-b",
          "provider": "example-provider-b",
          "reasoning_mode": "unknown",
          "source": "example adapter observation",
          "timestamp": "2026-07-15T12:24:47Z",
          "confidence": "high",
          "freshness": "current"
        },
        "model_probe": {
          "schema_version": "valp-model-probe.v1",
          "status": "observed",
          "source": "example runtime adapter metadata",
          "observed_at": "2026-07-15T12:24:47Z",
          "ttl_seconds": 3600,
          "model": {
            "model_id": "example-model-b",
            "provider": "example-provider-b",
            "reasoning_mode": "unknown",
            "confidence": "high"
          },
          "session_identity": {
            "status": "known",
            "token": "sha256:example-session-b",
            "source": "example adapter generation",
            "generation": "12"
          }
        },
        "freshness_evaluated_at": "2026-07-15T12:24:47Z",
        "observation_age_seconds": 0,
        "observation_ttl_seconds": 3600,
        "mismatch": {
          "status": "match",
          "handling": "preserve",
          "details": "Declared and observed identities match."
        },
        "history_binding": {
          "agent_surface": "example-cli-b",
          "model_id": "example-model-b",
          "provider": "example-provider-b",
          "reasoning_mode": "unknown",
          "freshness": "current",
          "session_token": "sha256:example-session-b",
          "fingerprint": "12e9b7b4cba3f1cb643e8aed4f8d185fe0d549430db3e8eb761c59c1d7171ac2"
        },
        "history_invalidation_reasons": [],
        "history_status": "valid",
        "evidence_status": "strong",
        "role_eligibility": {
          "implementer": "eligible",
          "final_reviewer": "eligible"
        }
      },
      "permissions": ["read-only-review"],
      "context": {"hard_compression_pct": 70},
      "task_evidence": ["evidence/model-observations-start.md"]
    }
  }
}
